ID,Post Title,Rendered Content,Featured Image URL,Height,Width,Filesize (bytes),Categories,Platforms,NFT Link
2973,Yonas&#8217; Fik&#8217;iri,"Yonas’ Fik’iri ፍቅር &#8211; translated from Amharic to mean Yonas’ Love.\nThis piece is an ode to Yonas’ Late Mother. She writes a letter to her lamenting how she wishes she knew how best to love her and show up for her when she was alive. Her mother struggled and smiled through mental health issues. Although the grief lingers, she feels that there is a sense that maybe on the other side, paradise, she’s peaceful…happy.\n",https://welovetheart.optimism.io/wp-content/uploads/2023/12/Screenshot-2023-11-30-at-20.54.18.png,1370,1098,2668707,Generative Art,Highlight,https://highlight.xyz/mint/656b0bed15f119b945152de8
2969,Alisa,Beautiful hippie girl with blue eyes. Made it here : https://rudalle.ru/\n,https://welovetheart.optimism.io/wp-content/uploads/2023/12/f375e77628584b45870069a556fba6cc_00000.jpg,768,768,101831,Generative Art,"Holograph,Stability AI",https://app.holograph.xyz/collections/0x33407257e1ac346a9a589c44afa42df8ebefc95f/nfts/0x0000000000000000000000000000000000000000000000000000000000000001
2967,Julia,Do not miss the jewels in this portrait 😀\nThe edge of the blouse is made of the Julia set of the quadratic polynomial z^2-1; the necklace is made of the Julia set for the function associated to Newton&#8217;s method for some slightly more complicated polynomials.\nPlease enjoy the elegance of mathematics.\n,https://welovetheart.optimism.io/wp-content/uploads/2023/12/julia.jpg,940,1618,206013,Generative Art,OpenSea,https://opensea.io/assets/optimism/0xdc4bc94adf7190e2ff0f6e5b0fe3c57b2f6693df/3
2963,SketchyGlitch #1,"The first piece in an exploratory collection of one-off glitch art.\nWhen I was in school I often felt the urge to sketch little drawings, often resorting to horizons and simple designs. The act of doing the sketching being more important than the outcome of the piece itself.\nI&#8217;ve been learning how to use new tools and have really been enjoying the creative process. This collection is primarily for the enjoyment of this exploration process while documenting my journey and also offering some unique pieces at a low price to those who are paying attention. Enjoy!\n",https://welovetheart.optimism.io/wp-content/uploads/2023/12/SketchyGlitch-1.gif,null,null,null,Generative Art,Manifold,https://gallery.manifold.xyz/sketchyglitch1
2961,Mesmerizing cls,This work consists of designing and combining the use of programs to create this image and using chat gpt while designing this work.\n,null,null,null,null,Generative Art,OpenSea,https://opensea.io/assets/optimism/0xf3e7109d6eac9a9b1895cbb0aa58b71f21b7c24f/2
2959,Working Like a Dog,"&#8220;Working like a dog and dreaming to run free.&#8221; I built this using Midjourney and it took much longer than I expected to finally realize the vision. Ultimately, I am very pleased with the result and hope you like it. \n",https://welovetheart.optimism.io/wp-content/uploads/2023/12/Working-Like-a-Dog.png,865,865,1141310,Generative Art,Highlight,https://highlight.xyz/mint/656aad5215f119b945152de2
2957,CRIMSON NEBULA HAVEN,"In the heart of the Crimson Nebula Haven, a mesmerizing isometric city rises from a red landscape, a testament to boundless imagination. Within this dimension, voxel structures form a labyrinth, home to ethereal beings. Above, a majestic dragon soars, its iridescent scales reflecting the surreal hues below. As citizens go about their lives, the dragon serves as a guardian, its presence weaving an otherworldly melody through the voxel city. In this parallel realm, where creativity knows no bounds, a vibrant cityscape thrives amidst the enigmatic embrace of the Crimson Nebula.\nlΞMONY 🍋 voxel art &#8211; 2023\n",https://welovetheart.optimism.io/wp-content/uploads/2023/12/crimson-nebula-haven-scaled.jpeg,2560,2560,3084741,Generative Art,Manifold,https://gallery.manifold.xyz/optimism/listing?listingId=224
2955,weLUVtheART,A glitching humanoid with a cyberpunk color scheme | Just like AI glitching. Plus a cool text animation which reads &#8220;We LOVE the ART&#8221;. Featuring the Heart X Cross Perspective Art animation which is based on John 3:16.\n,https://welovetheart.optimism.io/wp-content/uploads/2023/12/weLuvtheART_preview.gif,null,null,null,Generative Art,Zora,https://zora.co/collect/oeth:0x7836429b99996f3931af6097459b5299c0675588/1
2953,Martians Xclusive drop,"Martians is a unique collection started on Solana but will also have exclusive drops on various platforms. This is an expanding collection that Dedos The Nomad will be focusing on from time to time in various mediums, physical and digital. The collection retrospectively reflects on positive icons that impacted our culture as a whole.\n",https://welovetheart.optimism.io/wp-content/uploads/2023/12/Mars_X15-scaled.jpg,2560,2270,760868,Generative Art,Manifold,https://app.manifold.xyz/c/dedos-thenomad
2951,Love or We&#8217;ve come too far,"This NFT is a part of my collection titled &#8216;Mindset Mints on Optimism.&#8217; While generating pictures in various styles and on different topics, the concept of affirmation cards emerged. I realized that all our different states of mind can be connected to either optimism or pessimism. This realization served as the missing link during the iterative process of shaping my work. The path towards affirmation cards became increasingly intuitive.\nI&#8217;ve created 6 mints, each accompanied by a corresponding statement intended to complement the emotion evoked by my artwork. My hope is that people not only have fun looking at these pictures but also take away a personal lesson in mindfulness.\nI thoroughly enjoyed developing this concept step by step and plan to expand this collection by adding more mints in the future.\n",https://welovetheart.optimism.io/wp-content/uploads/2023/12/hanzzzel_get-lucky.png,1200,960,2183689,Generative Art,Manifold,https://gallery.manifold.xyz/optimism/listing?listingId=243
2947,Happiness or The Music of Sound,This NFT is part of my &#8220;Mindset Mints on Optimism&#8221;. As I generated pictures in different styles and on different topics the concept of affirmation cards came to my mind. All of our different states of mind can be linked to optimism or pessimism. This was the missing link while iterating through and reshaping my work. It became more and more intuitive to follow this path. I created 6 mints that also contain a corresponding statement that should complement the emotion that my artwork triggers. I hope people have fun when looking at these pictures and also take away a private lesson in mindfulness.\nI enjoyed developing this concept step by step; and I am planning to add additional mints to this collection.\n,https://welovetheart.optimism.io/wp-content/uploads/2023/12/hanzzzel_the-music-of-sound.png,1024,1024,1952359,Generative Art,Manifold,https://gallery.manifold.xyz/optimism/listing?listingId=237
2945,Closely,"I was traveling with friends in the Caribbean, enjoying camping on the beach under the coconut trees. My friend asked me why don&#8217;t you write a song, and so I went for a swim and this song came out. I recorded it in Denver and the lovely Kaeru Dawn produced it. Later on we made a music video in the beautiful mountains of Honduras. This song is about that feeling when you see that everything is changing but you just want the people you care about be close to you now, as that&#8217;s really what matters. \n",https://welovetheart.optimism.io/wp-content/uploads/2023/12/2716771-newImage.jpg,750,750,71164,Generative Art,Sound.xyz,https://www.sound.xyz/dominika/closely
2943,On The Other Side,"&#8220;On The Other Side&#8221; is a dance house track that tells a story of an oppressed society searching for liberation. The song features a soaring lead vocal &amp; sweet melodies over a gradually building composition. The song climaxes at a unorthodox drop that sounds like a light at the end of a tunnel. &#8220;On The Other Side&#8221; was written, performed, and co-produced by TK, and features production by Trey Smith. \n",https://welovetheart.optimism.io/wp-content/uploads/2023/12/on-the-other-side-small.jpg,1024,1024,1034708,Generative Art,Sound.xyz,https://www.sound.xyz/tk/on-the-other-side-w-trey-smith
2941,Supper of Enlightenment: The OP Revelation,"&#8220;Supper of Enlightenment: The OP Revelation&#8221; reenvisions the seminal moment from Leonardo da Vinci&#8217;s &#8216;The Last Supper&#8217; through the lens of transcendental symbolism. At the heart of the gathering, the central figure offers not bread, but a glowing red coin OP to his attentive disciples. This mystical coin, ablaze with an aura of enlightenment, becomes the new vessel of wisdom, a token of a deeper understanding that transcends the material world. The disciples, arrayed in richly colored robes, lean in with expressions ranging from awe to contemplation, each drawn to the coin&#8217;s radiant promise. Suspended above the table, it casts a divine light that envelops the room, signifying a moment of profound revelation and spiritual awakening.\n",https://welovetheart.optimism.io/wp-content/uploads/2023/12/DALL·E-2023-12-01-21.39.47-A-scene-inspired-by-The-Last-Supper-by-Leonardo-da-Vinci.-In-the-center-a-figure-resembling-Jesus-with-a-peaceful-expression-is-offering-a-red-co.png,null,null,null,Generative Art,Mint.fun,https://mint.fun/op/0x98Bf9F98121B7B3DF65aB7cFF569D2fD7747dBdb
2939,The Man Who Lost The World,"The Man Who Lost The World \nConcept &#8211; This story was created as a depiction of dissociating from your surroundings, feeling unfamiliar with the world around you &amp; losing yourself in the process. I wanted to capture the distortion that comes from self-isolation. Ironically, I personally found myself experiencing all of these things as a result of creating this piece. After spending 14 hours a day for almost a month, I truly lost myself in the process of trying to make this piece as perfect as could be. I did not feel familiar with the world outside, but for that, the work truly feels a part of me.\nProcess &#8211; Footage was edited &amp; cut up using Sony Vegas, then synced with music. Each scene was then processed through a 1998 CRT TV screen &amp; the signal was manipulated on various parts to replicate a glitch/distortion feel, all whilst being recorded on an iPhone. The files from the iPhone were then edited in Adobe After Effects with various effects/plugins &amp; tracked masking to create even more glitched &amp; surreal VFX. The footage was then exported into a 460-individual framed sequence, and each frame was then printed off. I numbered each piece of paper to keep track &amp; then applied mixed media techniques, such as crayons, paints, pens, scratching, texturing with various fabrics &amp; liquids, ripping, drawing &amp; much more. All 460 pieces of paper are then scanned back into my PC, touched up in Photoshop/Vegas &amp; then placed in an entire sequence to be rendered together with the music. This process requires a great deal of time &amp; patience but is completely worth it. \n",https://welovetheart.optimism.io/wp-content/uploads/2023/12/honest-man-gif.gif,null,null,null,Generative Art,Manifold,https://gallery.manifold.xyz/optimism/0x36d7621cec85d357402eba4679f085696e915af9/1
2937,The Offering of Wisdom: The Last Supper with the OP Coin,"In &#8220;The Offering of Wisdom: The Last Supper with the OP Coin,&#8221; the iconic Last Supper is reimagined with a contemporary twist. The central figure, reminiscent of Jesus, extends a hand towards a radiant red coin &#8216;OP&#8217;, infusing the scene with a new layer of symbolism. The disciples are portrayed in a state of varied reaction—wonder, contemplation, and profound intrigue—as they gaze upon the coin. This modern artifact becomes a focal point of unity and reflection, suggesting a new communion centered around the pursuit of knowledge and the power it holds. The scene merges the reverence of the traditional painting with a symbol of modern aspiration, creating a bridge across time that questions the values of the past and the philosophies of the present.\n",https://welovetheart.optimism.io/wp-content/uploads/2023/12/DALL·E-2023-12-01-21.39.53-A-scene-inspired-by-The-Last-Supper-by-Leonardo-da-Vinci.-In-the-center-a-figure-resembling-Jesus-with-a-peaceful-expression-is-offering-a-red-co.png,null,null,null,Generative Art,Mint.fun,https://mint.fun/op/0x9B0dda4D38d7D7b171c0C9f9b03E45B9c390915B
2935,Conclave of Wisdom: The OP Symposium,"In &#8220;Conclave of Wisdom: The OP Symposium,&#8221; a grand assembly of scholars and philosophers is depicted in fervent debate and discourse, echoing Raphael&#8217;s &#8216;The School of Athens.&#8217; At the heart of this congregation lies a red coin with &#8216;OP&#8217; inscribed upon it, resting upon the floor with a prominence that draws all attention. It acts as a catalyst for discussion, symbolizing the quest for knowledge and the wisdom sought by the learned figures surrounding it. The grandiose architecture of the hall, with its soaring arches and classical columns, frames the scene, emphasizing the magnitude of the exchange. This modern interpretation honors the pursuit of intellectual enlightenment, with the coin serving as a contemporary relic of profound insight.\n",https://welovetheart.optimism.io/wp-content/uploads/2023/12/DALL·E-2023-12-01-22.07.38-A-scene-inspired-by-Raphaels-The-School-of-Athens-with-philosophers-and-scholars-engaged-in-deep-discussion-about-divine-knowledge.-In-the-center-.png,null,null,null,Generative Art,Zora,https://zora.co/collect/oeth:0xcb25eb20ed6c8d23157d2b7e860a5722ecb0afd2/1
2931,Struggle of the Celestials: The OP Dichotomy,"In &#8220;Struggle of the Celestials: The OP Dichotomy,&#8221; the eternal conflict between light and darkness is captured in a moment of epic confrontation. Angels and demons, rendered with exquisite detail, clash around a glowing red coin that floats above the fray, inscribed with &#8216;OP&#8217;. This coin is the fulcrum of power, symbolizing the fine balance between good and evil. As the forces of purity and corruption battle for dominance, the coin pulses with a radiant energy, its presence an omniscient judge overseeing the war of virtues and vices. This piece is a visual allegory for the constant battle waged within and without, a representation of the choices that define destinies and shape the universe.\n",https://welovetheart.optimism.io/wp-content/uploads/2023/12/DALL·E-2023-12-01-21.47.55-An-artwork-inspired-by-Gustave-Dores-Paradise-Lost-depicting-angels-and-demons-in-a-celestial-battle.-In-the-center-of-the-conflict-a-red-coin-fe.png,null,null,null,Generative Art,Mint.fun,https://mint.fun/op/0xc4e4978515349e038bD6a77363a164692Af38E70
2929,Eden&#8217;s Opus: The OP Paradigm,"In &#8220;Eden&#8217;s Opus: The OP Paradigm,&#8221; Hieronymus Bosch&#8217;s iconic &#8216;Garden of Earthly Delights&#8217; is re-envisioned through a triptych of temptation, indulgence, and consequence. The red coin OP, floats dominantly across each panel, a metaphoric allure amidst the revelry and chaos. In the left panel, the coin subtly infuses Eden with a premonition of temptation. The central tableau bursts with mortal excess, the coin now central to their rapture. In the apocalyptic conclusion, the coin descends into the darkness of repercussion, a stark emblem of the cost of yielding to earthly desires. This reinterpretation breathes new symbolism into Bosch&#8217;s narrative, questioning the price of our choices in the pursuit of fleeting pleasures.\n",https://welovetheart.optimism.io/wp-content/uploads/2023/12/DALL·E-2023-12-01-22.00.38-A-reinterpretation-of-the-Garden-of-Earthly-Delights-by-Hieronymus-Bosch-incorporating-the-red-coin-with-OP-as-a-symbol-of-temptation-and-the-con.png,null,null,null,Generative Art,Zora,https://zora.co/collect/oeth:0x97b4b9e83d0cf19f1f47dade953fc5018a706272/1
2925,freedom!,freedom is a state of mind\n download10.sh download.sh output.txt posts_data.csv download10.sh download.sh output.txt posts_data.csv *\n&#8220;Freedom is the only worthy goal in life. It is won by disregarding things that lie beyond our control. Stop aspiring to be anyone other than your own best self: for that does fall within your control.&#8221; (Epictetus)\n,https://welovetheart.optimism.io/wp-content/uploads/2023/12/freedom.jpg,1080,1080,506477,Generative Art,Holograph,https://app.holograph.xyz/collections/0xc8702c1ce2a8472328b8d87aa48ca2e433d327fd/nfts/0x0000000000000000000000000000000000000000000000000000000000000003
2923,Ether&#8217;s Phoenix,"&#8220;Ether&#8217;s Phoenix&#8221; embodies the powerful synergy between art, mimetics, and web3 technology. Inspired by Karl Floersch&#8217;s concept of Ether&#8217;s Phoenix, this piece is a gateway to understanding the intricate mechanisms of RPGF in a more approachable manner.\nThis creative journey began during my time as a Creative Director at Gitcoin, where I initiated a dynamic NFT project titled &#8216;Ether&#8217;s Phoenix.&#8217; It was envisioned as an evolving digital collectible that would transform from an egg to a magnificent phoenix, symbolizing growth and change as users engaged in onchain, pro-social activities like grant donations. Although the project itself did not take flight, the burning inspiration behind it never faded.\nMy next exploration focused on making web3 approachable to a wider audience, leading to projects like the &#8216;Infinite Garden Coloring Book&#8217;. This included a dedicated coloring page and poem about Ether’s Phoenix. My latest endeavor, &#8216;Ace&#8217;—a physical trading card game—was launched in Istanbul at Devconnect. Within the &#8216;Regen vs Degen&#8217; decks, the battle between Gigachad and Ether’s Phoenix unfolds and it has been gratifying to see the consistently positive response. The golden holofoil phoenix card, in particular, has been immensely popular both within and outside the crypto community.\nThis artwork is a testament to the power of &#8216;regen&#8217; memes like Ether’s Phoenix in introducing and inspiring people about the magic of web3. It showcases how art can be a catalyst for positive change and can provide education through gameplay. The ultimate goal is to ignite action toward building a better world.\nThe creative process began with an image crafted using Midjourney and enhanced with a paintover in Photoshop. The card layout was designed in Figma, followed by a 3D render in Blender, and final compositing in DaVinci Resolve. The physical cards were brought to life by The Foil Printing Co., as seen at acetcg.xyz.\n“Together, we will summon Ether’s Phoenix.” May this work symbolize unity, transformation, and the boundless potential of web3.\n",null,null,null,null,Generative Art,Zora,https://zora.co/collect/oeth:0x66a3756c7922b9b3d5ab15330b6f572dc791a20a/11
2921,Ascension of the Chosen: The OP Covenant,"In a celestial tableau that reimagines Michelangelo&#8217;s masterpiece, &#8220;The Last Judgment,&#8221; ethereal beings ascend and descend around a central figure radiating serenity and authority. Each holds a red coin &#8216;OP,&#8217; symbols of divine judgment and the human quest for moral balance. This scene, painted with a heavenly palette, captures a moment of cosmic reckoning, where the coins serve as tokens of redemption, reflecting the deeds of those seeking favor in the afterlife. As the figures engage in a silent dialogue of fate, the coins glow with an otherworldly luminescence, casting a divine light on the eternal scales of justice.\n",https://welovetheart.optimism.io/wp-content/uploads/2023/12/DALL·E-2023-12-01-21.41.55-A-reimagined-version-of-the-Sistine-Chapels-The-Last-Judgment-by-Michelangelo.-In-this-modern-interpretation-the-angelic-and-demonic-figures-are-r.png,null,null,null,Generative Art,Zora,https://zora.co/collect/oeth:0xcb01bca1b3ac979c160fc7eed299f549dc57b3f7/1
2919,Celestial Harmony,This art demonstrates the combination of randomness and controlled motion to produce visually \nhttps://editor.p5js.org/kamyua/sketches/0OSZ4aSsn\n,https://welovetheart.optimism.io/wp-content/uploads/2023/12/Celestial-Harmony.png,925,1140,1299486,Generative Art,OpenSea,https://opensea.io/assets/matic/0x3927cbca306e1c44c8140c3fa426f002b4792f3b/1
2917,We Love the ArT,"Time filled with positivity is like a bright sunny day awakening energy and joy within us. It&#8217;s a time where each moment brings new possibilities and prospects. In positive times, we find inspiration in the little things: in a stranger&#8217;s smile, in the warmth of sunlight, in the sound of laughter. It&#8217;s a time when we strive to share kindness and attention, creating an atmosphere of joy and understanding around us. In positive times, we realize that every day is a gift, full of opportunities for growth, development, and well-being.\n",https://welovetheart.optimism.io/wp-content/uploads/2023/12/2023-12-01_16-49-31.jpg,741,739,62368,Generative Art,Sound.xyz,https://www.sound.xyz/summerwaves/positive-times
2915,We Love the ArT,The intensity and positive energy of &#8220;Summer Waves&#8221; will bring together creative people who are forward thinkers. This music is NOT for your parents!\n,https://welovetheart.optimism.io/wp-content/uploads/2023/12/2023-12-01_17-23-17.jpg,744,741,127184,Generative Art,Sound.xyz,https://www.sound.xyz/summerwaves/positive-times-rework-2016
2913,WE LOVE THE ART,testing\n,https://welovetheart.optimism.io/wp-content/uploads/2023/12/download.jpeg,177,284,12108,Generative Art,Mint.fun,https://www.google.com/
2911,Cosmic Equilibrium: The Red Coin of Creation,"In this cosmic tapestry, a divine figure reminiscent of William Blake&#8217;s &#8216;Ancient of Days&#8217; reaches out across the swirling nebulas and starfields of the universe, holding a red Optimism coin. This celestial coin radiates with a sublime energy, illuminating the cosmos and symbolizing the omnipotent act of creation. With a gaze fixed upon the intricate dance of creation and destruction, the deity&#8217;s gesture towards the coin suggests an intimate connection with the fabric of existence, balancing the forces of the cosmos with the simple, profound touch of the coin. This scene captures the timeless narrative of power and presence, a single moment of divine influence within the eternal expanse.\n",https://welovetheart.optimism.io/wp-content/uploads/2023/12/DALL·E-2023-12-01-21.40.06-A-modern-interpretation-of-William-Blakes-The-Ancient-of-Days.-The-divine-figure-depicted-in-a-contemporary-style-is-using-a-red-coin-with-the-wh.png,null,null,null,Generative Art,Zora,https://zora.co/collect/oeth:0xca94bef1ef46b38dc576e7d889fd42b2729a8819/1
2909,Venus and the Coin of Change,"In this evocative rendition, the timeless grace of Venus de Milo is captured in alabaster poise, her gaze imbued with contemplative depth. She delicately holds a vibrant red OP coin, a modern talisman that represents the transformative power of love. Set against a backdrop of classical columns and a crisp blue sky, the stark contrast of the coin in Venus&#8217;s ethereal grasp symbolizes the intertwining of ancient beauty with contemporary symbols of affection and change. This tableau is a harmonious blend of old-world elegance and new-age mystique, evoking a narrative where love is both an enduring force and a catalyst for evolution.\n",https://welovetheart.optimism.io/wp-content/uploads/2023/12/DALL·E-2023-12-01-21.58.36-An-image-inspired-by-the-Venus-de-Milo-where-the-goddess-of-love-is-holding-a-red-coin-with-OP-as-a-representation-of-loves-transformative-power.-.png,null,null,null,Generative Art,Mint.fun,https://mint.fun/op/0x403519504BCeDaAFa1Faee732BbA3201B9887c6f
2905,The Awakening of the Opulent Coin,"In a moment of serendipitous discovery, two young adventurers, a boy with earnest eyes and a girl with a look of astonishment, find themselves before an ancient pedestal in a mystical forest clearing. A radiant crimson coin bearing the inscription &#8216;OP&#8217; levitates above the pedestal, emanating a brilliant golden light that bathes the scene. The coin&#8217;s glow pulses with an otherworldly power, suggesting that it holds secrets and abilities far beyond their wildest imaginations. The backdrop of rugged mountains and the convergence of light hint at the beginning of an epic journey that this coin is sure to ignite.\n",https://welovetheart.optimism.io/wp-content/uploads/2023/12/DALL·E-2023-12-01-21.21.05-Anime-style-illustration-of-two-adventurers-one-male-and-one-female-discovering-a-crimson-coin-engraved-with-OP-in-a-mystical-setting.-The-scene-c.png,null,null,null,Generative Art,Zora,https://zora.co/collect/oeth:0xa284be7cf7d11e04061d98a5a60d49e254101d05/1
2903,Badador X Anunnaki Signal &#8211; Snake Jazz,"This come out from far teamwork between me in Tehran and my mate in Istanbul. Went like this, he got sounds from his modular stuff and sent over email to me. Then, I put in more sounds with my own gear and got the song sorted. Was all natural-like making, cause we both thinking same way. Whole album, we did with modular gear and fixed up in Ableton Live.\nMixed and Mastered by myself \n",https://welovetheart.optimism.io/wp-content/uploads/2023/12/artwork3k-scaled.jpg,2560,2560,627926,Generative Art,Sound.xyz,https://www.sound.xyz/badador/snake-jazz?referral_source=link
2901,Nordic City,Produced using Ableton (https://www.ableton.com/) and FL Studio (https://www.image-line.com/).\n,https://welovetheart.optimism.io/wp-content/uploads/2023/12/auxiliaries-nordic-city.jpeg,1485,1485,67472,Generative Art,Sound.xyz,https://www.sound.xyz/auxiliaries/nordic-city
