ID,Post Title,Rendered Content,Featured Image URL,Height,Width,Filesize (bytes),Categories,Platforms,NFT Link
3625,Cypher PIXXXXXEL,"Cypher is a unique creature from Pixelville, a digital realm where every being is a vibrant pixel creation. Unlike its peers, Cypher can change color with its emotions, suggesting it&#8217;s the descendant of the original ByteBuddy, a mythical figure linked to the source code of life itself. It&#8217;s on a quest to uncover its origins and protect its world from system bugs. Cypher&#8217;s enigmatic existence is a blend of adventure and guardianship, making it a cherished digital companion and a symbol of the potential within their pixelated world.\n",https://welovetheart.optimism.io/wp-content/uploads/2023/12/PIXXXXXEL004.png,941,941,2803,Generative Art,OpenSea,https://opensea.io/collection/pixxxxxel
3623,cosmic confetti,"https://editor.p5js.org/zimbo/sketches/quqDRh55A\nThis code generates a dynamic abstract artwork with a grid-like layout, filled with randomized shapes and colors. Each shape can be rotated, scaled, and colored with diverse options, creating a visually complex and ever-changing composition. The artwork is interactive, allowing viewers to press a key and instantly refresh the visual experience.\n",https://welovetheart.optimism.io/wp-content/uploads/2023/12/cosmic-confetti.png,925,925,473276,Generative Art,"Stability AI,Zora",https://zora.co/collect/zora:0xe04850baae272ec10c5b763ce0d2e3b7821646c2/premint-1
3619,Dear Leader Doge,"The piece is a playful yet respectful nod to historical propaganda art, using humor and internet meme culture to recontextualize a traditional format. &#8220;Dear Leader Doge&#8221; serves as a symbol of perseverance and leadership, aiming to inspire and amuse its audience. This artwork showcases the capabilities of AI in creating intricate and meaningful art, combining elements from different eras and cultural phenomena to produce something entirely new and captivating.\n",https://welovetheart.optimism.io/wp-content/uploads/2023/12/GreatLeaderDoge.webp,1024,1024,448788,Generative Art,OpenSea,https://opensea.io/assets/optimism/0x7cffe54eedf7e065b7743c028f807d8e27216513/2
3615,Digital Delights,"https://editor.p5js.org/heleena/sketches/DgKMuQPGz\nthis is vibrant and dynamic digital artwork, weaving together shapes, colors, and lines into a visually captivating composition. Imagine an abstract canvas pulsating with energy, where organic forms dance across the screen, leaving trails of light in their wake. \n",https://welovetheart.optimism.io/wp-content/uploads/2023/12/Digital-Delights.png,925,925,1466981,Generative Art,Zora,https://zora.co/collect/zora:0xd50566f994158d7e29e98071ff7ac9d6de30db96/premint-1
3611,777,A legendary character\n,https://welovetheart.optimism.io/wp-content/uploads/2023/12/23мма-4.png,null,null,null,Generative Art,Mint.fun,https://mint.fun/op/0x495E531ca8E5ecb131c6b8E12b1aafA0b7A2E088
3609,Ode to the bulls,The bulls must be blessed https://x.com/gabrielhaines/status/1722608231862685906?s=12&amp;t=LSguv4aTeRdwv7q7bj6jkw\n,https://welovetheart.optimism.io/wp-content/uploads/2023/12/Screen-Shot-2023-12-08-at-10.54.31-AM.png,320,688,477335,Generative Art,Zora,https://zora.co/collect/oeth:0xa0737951a51a598600d22ba3c19e4a209c4d649e/1
3607,Fallen Faces,"Imagine creatures stepping into our multiverse through a mathematical gateway. This concept underlines the belief in infinite life forms beyond our current knowledge, possibly governed by a singular, universal code. This mirrors the reality we experience daily.\nThese mathematically generated figures are an attempt to raise awareness about the existence of different universes. They remind us that often, our perception of the world is but a fragment of its entirety. Integrating the notion of community into generative art is particularly thrilling for me. Like many, I have often discerned faces in wood textures and other natural patterns. This phenomenon became more fascinating upon realizing that creating most of these patterns is entirely achievable using noise algorithms.\nTo me, noise is a wellspring of inspiration across various themes. By delving deep into the nuances of noise, one can discern diverse faces within, a process I find immensely enjoyable. I&#8217;ve also endeavored to manipulate the placement of facial features, making these figures more relatable as potential profile pictures (PFPs).\nPress &#8216;s&#8217; to save your unique slice of this imagined multiverse.\n",https://welovetheart.optimism.io/wp-content/uploads/2023/12/ff2.png,867,867,1281475,Generative Art,Highlight,https://highlight.xyz/mint/657302569df711f6313532bd
3605,Voyage Commencement: The Platform&#8217;s Omen,"&#8220;Voyage Commencement: The Platform&#8217;s Omen&#8221; captures the bustling energy and anticipation of a mystical train station where travelers, cloaked in the aura of adventure, are about to embark on an extraordinary journey. In the foreground, a grand red coin &#8216;OP&#8217; lies prominently on the cobblestone, symbolizing the magic and mystery that await. The iconic steam train, ready to depart, puffs out billows of smoke, adding to the excitement palpable in the air. As the gateway to a realm beyond, the platform thrums with the footsteps of eager souls, each an integral note in the symphony of tales about to unfold.\n",https://welovetheart.optimism.io/wp-content/uploads/2023/12/DALL·E-2023-12-08-20.26.54-An-inspiring-scene-of-the-Hogwarts-Express-departing-from-Platform-9¾.-The-iconic-steam-train-is-billowing-clouds-of-steam-as-it-begins-its-journey-to.png,null,null,null,Generative Art,Zora,https://zora.co/collect/oeth:0x42ca5651df32f1af1453ffc8496892fb43fbc556/1
3603,Conclave of Illumination: The Enigmatic Token,"&#8220;Conclave of Illumination: The Enigmatic Token&#8221; depicts a grand hall, aglow with the warm light of countless candles, where figures in ceremonial robes are gathered in silent reverence. At the center of this assembly floats a majestic red coin &#8216;OP&#8217;. It hovers above an ornate pedestal, emanating an otherworldly glow that bathes the onlookers in an ethereal radiance. The coin&#8217;s presence is the focal point of the solemn gathering, symbolizing knowledge and the esoteric wisdom sought by those in attendance. This scene is a blend of the mystical and the regal, capturing a moment of collective awe and the shared pursuit of arcane truths.\n",https://welovetheart.optimism.io/wp-content/uploads/2023/12/DALL·E-2023-12-08-20.26.42-An-enchanting-scene-set-in-a-grand-hall-reminiscent-of-Hogwarts-Great-Hall-during-a-sorting-ceremony.-The-hall-is-filled-with-students-in-robes-gath.png,null,null,null,Generative Art,Zora,https://zora.co/collect/oeth:0xf76a0aaf3921c8be6e3f952fdefc3af6fbde808e/1
3601,Lost in Lila,This work arose from a fantasy of man and the universe. It is one of a series of illustrations I created using procreate.\n,https://welovetheart.optimism.io/wp-content/uploads/2023/12/lost-in-lila-scaled.jpg,2560,2560,981425,Generative Art,OpenSea,https://opensea.io/assets/ethereum/0x495f947276749ce646f68ac8c248420045cb7b5e/71752185810806874318421251934348552535684602555518206388808720527564080152577/
3597,Regal Echoes: The Sovereign&#8217;s Sigil,"&#8220;Regal Echoes: The Sovereign&#8217;s Sigil&#8221; captures the essence of Baroque portraiture, presenting a dignified figure adorned in the opulent attire of a bygone era. With a richly detailed ruff framing his face and sumptuous fabrics cascading over his shoulders, he holds aloft a red coin &#8216;OP&#8217;. The coin is poised delicately between his fingers, suggesting both authority and the subtle nuances of power. His expression, self-assured yet enigmatic, invites speculation about the storied past this coin may represent. The dark, muted background serves to throw the figure and the vibrant coin into sharp relief, emphasizing the intersection of personal legacy and historical narrative.\n",https://welovetheart.optimism.io/wp-content/uploads/2023/12/DALL·E-2023-12-08-20.26.35-A-Baroque-masterpiece-akin-to-Diego-Velazquezs-portraits-featuring-a-dignified-figure-adorned-in-sumptuous-attire.-The-figure-is-portrayed-with-a-se.png,null,null,null,Generative Art,Zora,https://zora.co/collect/oeth:0x19d71ae6892bfa0812adc9a7cfce36d01617c164/1
3595,Coronation of Influence: The Monarch&#8217;s Token,"&#8220;Coronation of Influence: The Monarch&#8217;s Token&#8221; captures a resplendent moment in a royal court, where nobility is bathed in the golden glow of opulence. Dominating the scene is an imposing red coin OP intricately embossed, suspended above the assembly as a symbol of the ruler&#8217;s might and the realm&#8217;s prosperity. The courtiers, arrayed in sumptuous attire, cast their gazes towards this emblem of power, which reflects the grandeur of the era. The lavish draperies and gilded chandeliers enhance the majesty of the occasion, as the coin hovers like a celestial body, endowing the moment with a sense of gravity and historical significance.\n",https://welovetheart.optimism.io/wp-content/uploads/2023/12/DALL·E-2023-12-08-20.26.27-An-opulent-Baroque-inspired-scene-echoing-the-grandeur-of-Peter-Paul-Rubens-depicting-a-royal-court.-The-court-is-bathed-in-luxurious-fabrics-and-gol.png,null,null,null,Generative Art,Zora,https://zora.co/collect/oeth:0x738d1c130d335fe7c6c8afff11ec7fead734e1e8/1
3593,Pa&#8217;pa,"I&#8217;m draw this art with AI stable Diffusion midjourney type (https://colab.research.google.com/github/camenduru/stable-diffusion-webui-colab/blob/main/nightly/midjourney_v4_diffusion_webui_colab.ipynb), This work of art presents memes in the crypto network, the reason this work of art was created is to show that memes are not only about being funny but have amazing value. \n",https://welovetheart.optimism.io/wp-content/uploads/2023/12/meme.jpg,1080,1080,341519,Generative Art,"Stability AI,Zora",https://zora.co/collect/oeth:0xf107263bbe659cc1a7c9a29f1234b36c278fec57/3
3589,Radiance of Valor: The Guardian&#8217;s Coin,"&#8220;Radiance of Valor: The Guardian&#8217;s Coin&#8221; portrays a valiant warrior, a fusion of strength and grace, clutching a radiant red coin OP. The coin emanates a powerful glow, casting a divine light over her, symbolizing both her courage and the burden of her duty. Her armor reflects her readiness for battle, yet her gaze, directed towards a future only she can foresee, is filled with determination and hope. The dramatic chiaroscuro backdrop amplifies the intensity of her resolve, as she stands as a beacon of resilience against the gathering shadows. This painting celebrates the indomitable spirit embodied by those who guard the balance between light and darkness.\n",https://welovetheart.optimism.io/wp-content/uploads/2023/12/DALL·E-2023-12-08-20.26.21-A-Baroque-style-painting-reminiscent-of-Artemisia-Gentileschis-powerful-compositions-illustrating-a-fearless-heroine.-The-central-figure-is-a-strong.png,null,null,null,Generative Art,Zora,https://zora.co/collect/oeth:0xa94fc67c52d4cf1fcaaeb52a327e6eb28240b6ec/1
3587,Empyrean Convergence: The Garden of Reflection,"&#8220;Empyrean Convergence: The Garden of Reflection&#8221; is an artwork that captures the essence of a grand Baroque garden, echoing the sculptural genius of Gian Lorenzo Bernini. At its heart lies a magnificent fountain crowned by an ornate red coin OP, symbolizing the garden&#8217;s opulence and the reflective journey one embarks upon here. Surrounded by meticulously carved statues and lush topiaries, the coin stands as a beacon of contemplation, drawing visitors into a narrative woven from marble and water. This sanctuary melds the tranquility of nature with the artistry of man, inviting a pause in its serene yet grandiose embrace.\n",https://welovetheart.optimism.io/wp-content/uploads/2023/12/DALL·E-2023-12-08-20.26.12-An-artwork-capturing-the-spirit-of-Gian-Lorenzo-Berninis-sculptural-genius-showcasing-an-intricately-detailed-sculpture-garden-with-ornate-fountains.png,null,null,null,Generative Art,Zora,https://zora.co/collect/oeth:0x0e650d3b8e061f3cc333453f809eda02be672d4c/1
3585,First time I met you,"For her piece &#8220;First time I met you&#8221; Sarabi utilizes a striking palette of DeepSkyBlue, NavyBlue, MediumBlue, Gray, Crimson, and White. The work is a textured acrylic on raw canvas, measuring 120 x 100 cm, part of her series identified as Texture No. 007-2AS. Her method involves layering and a tactile approach that invites the viewer to not only see but feel the depth of the colors. The stark contrast of warm crimson against the coolness of blues exemplifies her exploration of color theory and emotional resonance. Sarabi&#8217;s work is a testament to her belief in the warmth of colors traditionally seen as cool, challenging the viewer&#8217;s perception and inviting a more profound emotional response.\n",https://welovetheart.optimism.io/wp-content/uploads/2023/12/WIB-First-I-Met-You.jpg,1473,1018,132985,Generative Art,Manifold,https://gallery.manifold.xyz/optimism/0xcf80223f8b048b2491ed94957eaf973b1a6da24c/24
3583,Woman,"The geography sometimes makes it hard to be a woman. You want to be soft as a feather, but you need to be rough as a piece of wood. Meanwhile, you may be fragile as a bubble but you must stay as sturdy as a stone. I have done many things in my life, but painting, and the dance of oil and color on a blank canvas, is the only one that reveals my true soul.\n",https://welovetheart.optimism.io/wp-content/uploads/2023/12/WIB-Woman.png,1051,586,953812,Generative Art,Manifold,https://gallery.manifold.xyz/optimism/0xcf80223f8b048b2491ed94957eaf973b1a6da24c/1
3581,Poussière,"Short animated illustration inspired by the song &#8216;Poussière&#8217; by Laura Cahen (French song writer). To respect the copyright regarding the original song, I didn&#8217;t include the music in this short, but it can be listened here: https://www.youtube.com/watch?v=hlFZpKJwSac\nI drew using Adobe Illustrator and animated the whole thing in Adobe Animate.\nHope you will enjoy it\n",null,null,null,null,Generative Art,OpenSea,https://opensea.io/assets/optimism/0xefa9225be7516de1484d4ff1ed68f5d7fdbf930f/1
3579,3. TOBYSSTAR &#8211; DREAMHERBS,"DREAMHERBS &#8211; a lo-fi instrumental mix tape comprised of dream like scenes and ideas.\nTOBYSSTAR is a 1 of 9 (no. 3) experimental lo-fi sonic arrangement designed to bolster one through time, space and the Ether. This one in particular recognizes the forces of light + dark in ones self and the never ending juggle of the two wolves inside. Visualizer represents looking through the eye of a needle at ones self navigating this concept.\nEven if you don&#8217;t pick me and were up for it, check the other tracks on this beat tape, namely .1 VALLEYS, .2 8BALLVIBE, 5. BALAMBSEED and .6 KRYPTON\nEvery instrumental was designed to be played through seamlessly with track before and after, beginning to end, offering a smooth play through for the listener.\nThank you for your ears &lt;3\n~ LXNGSHOT\n",https://welovetheart.optimism.io/wp-content/uploads/2023/12/DREAMHERBS.png,1222,1218,812381,Generative Art,OpenSea,https://opensea.io/assets/ethereum/0x495f947276749ce646f68ac8c248420045cb7b5e/83449505290995399754132134786155082301415985881638620377355795541870090649601
3577,We Love the Art,The concept of my work is a mixture. A mixture of modern art and philosophical reflections. Using graphics software tools and using artificial intelligence. Mixing all this is like mixing the colors of great artists.\nStages of creating a work: https://drive.google.com/drive/folders/1ltYlNRXHnqxffVBGLZMupG3Ai-fxDdKN?usp=drive_link\n1. work with a graphics program;\n2. work with a graphics program;\n3. created the file by artificial intelligence;\n4. work with a graphics program;\n5. in the finale he combined the work into a single whole. Mix of graphic editor and artificial intelligence.\n,https://welovetheart.optimism.io/wp-content/uploads/2023/12/1.1-scaled.jpg,2560,2560,525227,Generative Art,"OpenSea,Stability AI",https://opensea.io/assets/ethereum/0x09bd7f0c7cf30cb0ada1f8084125f25bbbdba2b3/1/
3575,L2 Fantasy,"L2 FANTASY is design to express power of Superchain and participate the great event We love the Art.This collection is created by AI tools, with theme and concept fantasy charactors.Optimism always support artists. I love Optimism too.\n",https://welovetheart.optimism.io/wp-content/uploads/2023/12/00079-2065416661.png,1024,768,1346508,Generative Art,"Stability AI,Zora",https://zora.co/collect/oeth:0x31a5abd2b54c114506ce30349b9c611f518a0a55
3573,Tree Of Life,"The Tree of Life motif holds different interpretations across cultures, religions, mythology, and philosophy. It is often a symbol of the connection with our ancestors and a metaphor for the passage of time from life to death. Since my father’s passing in 2019, I have contemplated life and death more than ever. Reading the different meanings of the Tree, and seeing the many artists who have used it as a symbol in their work, I was inspired to create my own version.\n",https://welovetheart.optimism.io/wp-content/uploads/2023/12/TOL.jpg,1333,2000,3868926,Generative Art,Manifold,https://gallery.manifold.xyz/0x2883877b2faae875721aa74ab11837597a9ba850/6
3568,Big O in red,Big O in red\n,https://welovetheart.optimism.io/wp-content/uploads/2023/12/Screenshot-2023-12-07-at-8.46.32 PM.png,null,null,null,Generative Art,OpenSea,https://opensea.io/assets/optimism/0xe91bef14bb48d7aeda14180ffc91c675232682db/1
3566,Greet Her With Your Heater,"In a sonic world where art is the ultimate animal, music evolution never ends, rising from the depths of the psyche to sing across a new sky. That’s where you’ll find me.\nInnately intelligent and original while being entertaining, this track utilizes abstracted yet still expressive vox, and a sense of excited humor.\nThe tune was created in Logic with numerous soft synths, and common microphones and keyboard for input. There’s nothing special about the technique employed, only the talent.\n",https://welovetheart.optimism.io/wp-content/uploads/2023/12/Greet-cover.jpg,2122,1990,1515301,Generative Art,Sound.xyz,https://www.sound.xyz/hturk/greet-her-with-your-heater
3564,Never Been To The Moon," I create brainy music to make you think about feeling fantastic, an alternative to “alternative” sounds. In a sonic world where art is the ultimate animal, music evolution never ends, rising from the depths of the psyche to sing across a new sky. That’s where you’ll find me. \nAs cool as the moon, this song approaches the expanse of outer space, and fills it with feeling.\nThe track was created in Logic with numerous soft synths, and common microphones and keyboard for input. \n",https://welovetheart.optimism.io/wp-content/uploads/2023/12/Moon-cover.jpg,968,968,535413,Generative Art,Sound.xyz,https://www.sound.xyz/hturk/never-been-to-the-moon
3562,Dear Idea,"This electro-acoustic work consists of animal, insect, and other nature sounds along with electronic associations: Upon encountering a scene with an aural theme redolent of quasi-natural sounds from animals that might have never lived and robotic voicings that seem part of the landscape instead of the speaking of its populace, a denouement of silence occurs after nature has the final word (and it’s a howl).\nThe track was created in Logic with numerous soft synths, and common microphones and keyboard for input. \n",https://welovetheart.optimism.io/wp-content/uploads/2023/12/DI-cover.jpg,968,968,953424,Generative Art,Sound.xyz,https://www.sound.xyz/hturk/dear-idea
3560,Flashes Of Crashed Passage,"Strange sound creatures make their way across a landscape of dark bones until crashing into a phalanx of audio birds. Erupting into sonic flight, the birds flash their frightening wings, calling out brightly to the sky, their sanctity. \nThis is not a tune, but a composition. It’s not something you get over and done with. It’s a spectacle.\n I create brainy music to make you think about feeling fantastic, an alternative to “alternative” sounds. In a sonic world where art is the ultimate animal, music evolution never ends, rising from the depths of the psyche to sing across a new sky. That’s where you’ll find me.\n",https://welovetheart.optimism.io/wp-content/uploads/2023/12/Flash-cover-for-sub.png,960,960,977412,Generative Art,Sound.xyz,https://www.sound.xyz/hturk/flashes-of-crashed-passage
3558,Ladies Of The Otherlife,"A multiverse person with the demeanor of a doll and the apparel of royalty from another dimension. Feminine yet sexless, the person exhibits a new type of beauty, housing in its attire the joy of childhood, assuming youth yet literally ageless.\nWhether new or old, art by nature distorts reality, often while attempting to add to our understanding of how perception alters experience. The experience here is not bizarre, but a new type of fascinating beauty. Beauty is in the eye of the beholder, if they can only see it.\n",https://welovetheart.optimism.io/wp-content/uploads/2023/12/Ladies-Of-The-Otherlife.jpg,2540,1555,1232360,Generative Art,Manifold,https://app.manifold.xyz/c/Ladies-Of-The-Otherlife
3556,Darkday,"The world’s shortest spoken-word graphic novel. An official holiday of the metaverse, DARKDAY is when demons from alternate realities invade your life in search of a love they could never find in their own home. \nWith this piece, my concept is to utilize cryptoart as a medium for my long-established writing and spoken-word art combined with the potential of AI (which generated all the images).\n",https://welovetheart.optimism.io/wp-content/uploads/2023/12/Darkday-cover-for-sub.jpg,1088,1088,604476,Generative Art,Manifold,https://app.manifold.xyz/c/Darkday
3554,A Love Supreme,One of many instruments featured in the series Abstract Jazz. This AI artwork was created using VQGAN + CLIP.\n,https://welovetheart.optimism.io/wp-content/uploads/2023/12/AJ-A-Love-Supreme-scaled.jpeg,2560,1707,1213829,Generative Art,"OpenSea,Stability AI",https://opensea.io/assets/matic/0x2953399124f0cbb46d2cbacd8a89cf0599974963/65350531189312466719965629878300611675619064901309659795896823506030127218789
3552,World on Fire,"Image of an original painting, based on my mural for Rainforest Alliance. I used large brushes and acrylic paints on scaffolding to create this 40ft high large mural for Upfest, Europe&#8217;s biggest street art festival back in August 2021, Bristol. I wanted to highlight the urgent climate crisis, so named it &#8220;World on Fire&#8221;. It&#8217;s my interpretation of a forest on fire. I mentioned Rainforest Alliance beside it &#8211; a charity close to my heart, in which I have donated to numerous time when I have sold original rainforest paintings and prints. \n",https://welovetheart.optimism.io/wp-content/uploads/2023/12/Worldonfire.png,2077,1510,6057790,Generative Art,OpenSea,https://opensea.io/assets/optimism/0xb2fb76fe26020761cf56ce3266aa7d5f4e96c872/7
3546,“how do u feel?” (on Zora),"I produced, recorded and engineered this record myself at home one night while I was going through a tough breakup. This song symbolizes my inner reflections and thoughts on love and relationships after a failure. At the time I was also studying drum patterns and this song happened to fall in my four on the floor, 1980sish phase. For production I used Ableton Live and for recording and mixing I used Logic Pro. To polish off the song I leveraged AI for mastering the final track.\n",https://welovetheart.optimism.io/wp-content/uploads/2023/12/33714EE0-E1E8-406F-BA93-5BBE17F95582.jpeg,947,955,103259,Generative Art,Zora,https://zora.co/collect/zora:0x28540a153ea535cdd75ec358ed4818d40d67ded6/premint-1
3544,L.Melky &#8220;africaSPB&#8221;,What&#8217;s out your window?\n,https://welovetheart.optimism.io/wp-content/uploads/2023/12/АФРИКА.SPB_-scaled.jpg,null,null,null,Generative Art,Holograph,https://app.holograph.xyz/collections/0x617159309c158ca1646195dd00fd1224638d0286/nfts/0x0000000000000000000000000000000000000000000000000000000000000001
3542,Sin City,"This piece is about humanity&#8217;s unconscious desires expressed (greed, power, fortune, etc.) . A moral dilemma that has no right or wrong answer as the outcome is the same. Regardless of our choice, we must experience our true nature whether in fantasy or reality.\nSymbolically represented in the backdrop of New York City, a city with an ambitious reputation.\n*Creation Process: A photograph taken in my hometown of New York City that has been digitally painted and animated with 2d motion + music independently produced. \n",https://welovetheart.optimism.io/wp-content/uploads/2023/12/img-sin-city.jpg,645,828,646350,Generative Art,OpenSea,https://opensea.io/assets/ethereum/0x495f947276749ce646f68ac8c248420045cb7b5e/65350531189312466719965629878300611675619064901309659795896823175077127258113
3540,We Love the Art,"I tried to create an original work by using Photoshop and various artificial intelligence programs. Since I thought 2023 was the year of Optimism and this would continue in 2024, I wanted to create a Christmas-themed work in this way. I hope you will like it. hOPpy new year..\n",https://welovetheart.optimism.io/wp-content/uploads/2023/12/Year-of-OPtimism.jpg,780,800,204146,Generative Art,Zora,https://zora.co/collect/zora:0x42e061fc68dd617b8b31ea3d7b5c0133616a2032/1
